{
  "schema_id": "t6_coordinator_role_registry_v4",
  "schema_version": 4,
  "registry_id": "t6_coordinator_role_registry_v4",
  "status": "HEAD_BOUND_Q1_ROOT_PREFIX_SCOPED_E1_AUTHORITY_NO_SUCCESSOR_OR_RECURSION",
  "activation_status": "ACTIVE_EXACT_HEAD_AUTHORITY",
  "authority_policy": {
    "source": "TRACKED_GIT_OBJECTS_AT_EXACT_REQUESTED_HEAD",
    "caller_override_authority": false,
    "worktree_authority": false,
    "fixed_owner_domain": "ordinary_parentless_q1_g_root_v1",
    "inherited_registry_id": "t6_coordinator_role_registry_v3",
    "new_roles": [
      "COMMON_ROOT_OWNER_CLASSIFIER",
      "INDEPENDENT_SCOPE_AWARE_E1_VALIDATOR",
      "REGISTERED_PREFIX_E1_CONSUMER"
    ],
    "role_modules_must_be_loader_free": true
  },
  "artifacts": [
    {
      "artifact_id": "persistent_owner_contract_reference_v1",
      "artifact_class": "REFERENCE_ONLY",
      "kind": "PYTHON_REFERENCE_SYMBOL_SET",
      "path": "scripts/t6_persistent_selector_state_v1.py",
      "symbols": [
        "_family_predicates_v1",
        "classify_selector_owner_v1",
        "owner_digest_v1"
      ],
      "pin_status": "PINNED",
      "semantic_digest_method": "PYTHON_STABLE_AST_SYMBOL_SET_BLOB_CLOSURE_DEPENDENCY_SHA256_V4",
      "dependency_manifest": {
        "execution_artifact_ids": [],
        "binding_artifact_ids": [],
        "binding_document_ids": [],
        "artifact_semantic_pins": {}
      },
      "expected_blob_sha256": "7bb5d0287f0dfed85dafc098e3c0483955f48e613fe9bef4c7caa9507a4e3c8c",
      "expected_symbol_ast_sha256": {
        "_family_predicates_v1": "4156718bf4757f57f9e079a90fb8afa334483935cf1ab886344086c9aa5e5c92",
        "classify_selector_owner_v1": "f0126eb7feaa16206e1fe7a6183cafc8fc702e8a4b73f787aec5099b4add317b",
        "owner_digest_v1": "a0229b678af5a96b792ea77f9bb62f840fad5bdc264c0103b7a3ed2d9b3a5d2a"
      },
      "expected_symbol_set_digest": "69d05846a6da33035dcb98952d154f197872f2cc8392a8cd25c87406905a3111",
      "expected_local_import_closure_digest": "aebdb3a0116748f591b149f55d741b5f6cff9ef74e8254d0a32fccc1ee45647f",
      "expected_dependency_manifest_digest": "e4e6f733f84c26993bd7e31e7d2b3a521f505f4df1c5b4754a39722cf1fc2d63",
      "expected_semantic_sha256": "2f9c34f72b00217788cefd264606d2800e89de5502272630f587913429fe85b4"
    },
    {
      "artifact_id": "q1_registered_prefix_e1_consumer_v2",
      "artifact_class": "ROLE_ARTIFACT",
      "kind": "PYTHON_SYMBOL_SET",
      "path": "scripts/t6_q_one_registered_prefix_e1_consumer_v2.py",
      "symbols": [
        "consume_q_one_registered_prefix_miss_for_e1_v2",
        "root_source_scoped_e1_receipt_to_mapping_v2"
      ],
      "pin_status": "PINNED",
      "semantic_digest_method": "PYTHON_STABLE_AST_SYMBOL_SET_BLOB_CLOSURE_DEPENDENCY_SHA256_V4",
      "dependency_manifest": {
        "execution_artifact_ids": [],
        "binding_artifact_ids": [
          "q1_root_owner_classifier_v2",
          "q1_scope_aware_e1_validator_v2",
          "v3_production_receipt_verifier_dependency",
          "v3_root_initializer_dependency"
        ],
        "binding_document_ids": ["schemas/t6-q-one-root-prefix-scoped-e1-v2.schema.json"],
        "artifact_semantic_pins": {
          "q1_root_owner_classifier_v2": "4d99732d962c35a7d0ef7ad994d2be27b33e9e7a80ee655805979c0392942c28",
          "q1_scope_aware_e1_validator_v2": "b692e6e5f3d12089f5abeedd024cba02d497a438ec31dba1e91865a6754dcc0f",
          "v3_production_receipt_verifier_dependency": "36af56a8f6699a1e670f435625255f021c5aecc339193207fd9b3376e65725e2",
          "v3_root_initializer_dependency": "68c55e5bb8065d1139ab601e10dba4412fcae4a35ee01a6c8cec3ec3748a4a16"
        }
      },
      "expected_blob_sha256": "056e10087d76a012ce1abba8b8e657f6fdb988c3ccc47f2fed99372a8016b0f3",
      "expected_symbol_ast_sha256": {
        "consume_q_one_registered_prefix_miss_for_e1_v2": "feab892571e50afb90970d82b29d3d0535ab6771b3a921ea900c9cda602a8749",
        "root_source_scoped_e1_receipt_to_mapping_v2": "7f0b4cdf28bd131419b675ed6244e54e3ed64ca2d8f6413191e729e6bca56231"
      },
      "expected_symbol_set_digest": "06f11e14e087f7d8c5c7ea81a0d1d29b0d57e18ef24f3647a14e2ff66948127e",
      "expected_local_import_closure_digest": "0452f213f56859a8e84781fe1f0855c87d5f535c2374e81ff97704e60556cc90",
      "expected_dependency_manifest_digest": "d7fbd77de2caed7b8f4ff73b9db8be42ee726771678a4d21eb21a7598e189a54",
      "expected_semantic_sha256": "0745b05f36cb9d62cd3835aa343dcf8eba926094f8cd98c351d30535111baecc"
    },
    {
      "artifact_id": "q1_root_owner_classifier_v2",
      "artifact_class": "ROLE_ARTIFACT",
      "kind": "PYTHON_SYMBOL_SET",
      "path": "scripts/t6_q_one_root_owner_classifier_v2.py",
      "symbols": [
        "classify_q_one_root_owner_v2",
        "root_owner_receipt_to_mapping_v2"
      ],
      "pin_status": "PINNED",
      "semantic_digest_method": "PYTHON_STABLE_AST_SYMBOL_SET_BLOB_CLOSURE_DEPENDENCY_SHA256_V4",
      "dependency_manifest": {
        "execution_artifact_ids": [],
        "binding_artifact_ids": [
          "persistent_owner_contract_reference_v1",
          "v3_root_initializer_dependency"
        ],
        "binding_document_ids": ["schemas/t6-q-one-root-prefix-scoped-e1-v2.schema.json"],
        "artifact_semantic_pins": {
          "persistent_owner_contract_reference_v1": "2f9c34f72b00217788cefd264606d2800e89de5502272630f587913429fe85b4",
          "v3_root_initializer_dependency": "68c55e5bb8065d1139ab601e10dba4412fcae4a35ee01a6c8cec3ec3748a4a16"
        }
      },
      "expected_blob_sha256": "500e44221ab8591c3725c56579306a5aa5a79d3570c8cd5c194ae8380e71197b",
      "expected_symbol_ast_sha256": {
        "classify_q_one_root_owner_v2": "53423661bc90fc40493116e81612390e4f3670d9c7f64a5c04a02044400e3132",
        "root_owner_receipt_to_mapping_v2": "6af39e5b2967a0c3a2b703247c21c0d44e2aaaed62c31fef168e0b282ac59653"
      },
      "expected_symbol_set_digest": "093aebfafb9d75b6dfe82b843b9fe290de1a3c502237816cfe3f12880e7edb7d",
      "expected_local_import_closure_digest": "c4a00d0eadb3aa8177d44a618f5b948e6b0844b3b31d381b6d4360c5640aa1f1",
      "expected_dependency_manifest_digest": "6139fde63904864c75639e6c9ccd544344fb0808819b1a282881c0a6da988c71",
      "expected_semantic_sha256": "4d99732d962c35a7d0ef7ad994d2be27b33e9e7a80ee655805979c0392942c28"
    },
    {
      "artifact_id": "q1_root_prefix_scoped_e1_orchestrator_v2",
      "artifact_class": "CONTROLLED_LOADER_ORCHESTRATOR_ONLY",
      "kind": "PYTHON_SYMBOL_SET",
      "path": "scripts/t6_q_one_root_prefix_scoped_e1_orchestrator_v2.py",
      "symbols": ["assemble_q_one_root_prefix_scoped_e1_v2"],
      "pin_status": "PINNED",
      "semantic_digest_method": "PYTHON_STABLE_AST_SYMBOL_SET_BLOB_CLOSURE_DEPENDENCY_SHA256_V4",
      "dependency_manifest": {
        "execution_artifact_ids": [
          "q1_registered_prefix_e1_consumer_v2",
          "q1_root_owner_classifier_v2",
          "q1_scope_aware_e1_validator_v2",
          "v3_production_receipt_verifier_dependency",
          "v3_registry_resolver_dependency",
          "v3_root_initializer_dependency"
        ],
        "binding_artifact_ids": [],
        "binding_document_ids": [
          "data/t6-wave1/t6-coordinator-role-registry-v4.json",
          "schemas/t6-coordinator-role-registry-v4.schema.json",
          "schemas/t6-q-one-root-prefix-scoped-e1-v2.schema.json",
          "scripts/t6_coordinator_role_registry_v4.py"
        ],
        "artifact_semantic_pins": {
          "q1_registered_prefix_e1_consumer_v2": "0745b05f36cb9d62cd3835aa343dcf8eba926094f8cd98c351d30535111baecc",
          "q1_root_owner_classifier_v2": "4d99732d962c35a7d0ef7ad994d2be27b33e9e7a80ee655805979c0392942c28",
          "q1_scope_aware_e1_validator_v2": "b692e6e5f3d12089f5abeedd024cba02d497a438ec31dba1e91865a6754dcc0f",
          "v3_production_receipt_verifier_dependency": "36af56a8f6699a1e670f435625255f021c5aecc339193207fd9b3376e65725e2",
          "v3_registry_resolver_dependency": "82acffeb085efa203bfae019b737c7c4610d785d626284d7a72adc727314b4a6",
          "v3_root_initializer_dependency": "68c55e5bb8065d1139ab601e10dba4412fcae4a35ee01a6c8cec3ec3748a4a16"
        }
      },
      "expected_blob_sha256": "f5b31286be17b102f35684d193a96491f34a8be85f88f11b8aec0b9573fa1def",
      "expected_symbol_ast_sha256": {
        "assemble_q_one_root_prefix_scoped_e1_v2": "7a9df28e6b71c0787486df37ee9a2c7994d3f40e9070241719f93cc27f4037a2"
      },
      "expected_symbol_set_digest": "76cd1fa38a76bbdaf2a8f21387c079632c58e7570177976ebb91b99b20ce0e31",
      "expected_local_import_closure_digest": "69f36a9108c112f08320211a199e390f49ec6f5964819bd1b1145d5bb5dbbdc6",
      "expected_dependency_manifest_digest": "a396602ce319b463af82614a00a1091fe4acc9729c2d64177ce3099bc5ae21b4",
      "expected_semantic_sha256": "4ce3c9ee11dc510a1fed17996093c691a8556268dd7b86a125fd7f58ae15a518"
    },
    {
      "artifact_id": "q1_root_prefix_scoped_e1_receipt_verifier_v2",
      "artifact_class": "POST_ISSUANCE_REPLAY_DEPENDENCY_ONLY",
      "kind": "PYTHON_SYMBOL_SET",
      "path": "scripts/t6_q_one_root_prefix_scoped_e1_receipt_verifier_v2.py",
      "symbols": ["verify_q_one_root_prefix_scoped_e1_receipt_v2"],
      "pin_status": "PINNED",
      "semantic_digest_method": "PYTHON_STABLE_AST_SYMBOL_SET_BLOB_CLOSURE_DEPENDENCY_SHA256_V4",
      "dependency_manifest": {
        "execution_artifact_ids": [
          "q1_registered_prefix_e1_consumer_v2",
          "q1_root_owner_classifier_v2",
          "q1_scope_aware_e1_validator_v2",
          "v3_production_receipt_verifier_dependency",
          "v3_registry_resolver_dependency",
          "v3_root_initializer_dependency"
        ],
        "binding_artifact_ids": [
          "q1_root_prefix_scoped_e1_orchestrator_v2"
        ],
        "binding_document_ids": [
          "schemas/t6-q-one-root-prefix-scoped-e1-v2.schema.json",
          "scripts/t6_coordinator_role_registry_v4.py"
        ],